আলাওল		
## বাহরাম রাজার জন্ম এবং ইমন দেশে		
## খয়ানিক পুরীর গঠন		
*(জমক ছন্দে কেদার)*		
প্রসিদ্ধ এরাক দেশ জগতে বিদিত।		
বৈসে সাধু সৎলোক সদা হরিষত॥		
মহা সুখ আনন্দে বঙ্গয় সর্ব লোক।		
বান্ধবে বিচ্ছেদ নাই নাই দুঃখ শোক॥		
তাহে মহা ছত্রপতি নামে নরমান।		
এই দোষ নাঞ্জ তার নেহ মোছলমান॥		
পুত্র তুল্য প্রজা পালে সুখে বেতে প্রজা।		
বিধি বেশে আরব আজম দেশে রাজা॥		
বংশ মাঝ রাজার না রহে পৃথিবীত।		
যেই পুত্র কন্যা জন্মে মরয় তুরিত॥		
এই সব মনেতে মানস নিরন্তর।		
দিব্য এক পুত্র দান করিতেন্তু ঈশ্বর॥		
ন্যায় হেল নৃপতি কুকর্ম তেয়াগিয়া।		
নিত্য শাস্ত্রমতে করে প্রভুকে ভাবিয়া॥		
তবে রাজ মহাদেবী হেলা গর্ভবতী।		
দশ মাসে প্রসিবলা উত্তম সন্তুতি॥		
রশি রাশি জন্ম হেল উদরেত গিয়া।		
রশি বর হেন চন্দ্র হরিণী তাজিয়া॥		
মৈচত গনেশ দুই হেল এক মতি।		
দৈত্য গুরু সুর গুরু শুক্র বৃহস্পতি॥		
মিথুনে আছিল বুধ সিংহেত মঙ্গল।		
তুলাতে রহিল শনি হইয়া পাতল॥		
কর্কটেতে বিধুনদ মকরেতে কেতু।		
মকর কেতন রূপ নানা সুখ হেতু॥		
গ্রহপতি মেষেত উত্তঙ্গ প্রজ্জুলিত।		
ভাগ্যের উদয় হেতু গ্রহের ইঙ্গিত॥		
মৈচন্দ্রের চতুর্থী ঘড়ি নিশি তিন জাম		
মধু মাসে দশ মৃগ শিরা।		
অনুপাম গ্রহকুল সদয় যেতক হৈল নাম		
বাছিয়া নৃপতি নাম থুইল বাহরাম॥		
বিজ্ঞ যত বিপ্র সেবে দিলেক ব্যাবস্থা।		
কদাচিত এই শিশু না রাখিও এথা॥		
আরেবত বাস দেও দেখি দিব্য স্থল।		
তবে সে হইব শিশু সর্বত্রে কুশল॥		
নিত্যই ভাগ্য তার হইব উতঙ্গ।		
মহা ধনুর্ধর হৈব রিপুদল ভঙ্গ॥		
তাহা শুনি নৃপতি হইল দুঃখ ভাগি।		
চিত্ত হেন্তে পুত্র স্নেহ তেজি হিত লাগি॥		
বাছিয়া ইমন দেশে দিলেক নিবাস।		
দ্বিতীয় অগস্ত হেল ইমনে প্রকাশ॥		
মেযামান নামে এক পুরুষ প্রধান।		
অস্ত্র শাস্ত্র বিদ্যা গুণে শত অবধান॥		
পুত্র কোলে করি রাজা তাহাতে সপিল।		
বহু সৈন্য হয় হস্তি ধন রত্ন দিল॥		
এক ধাত্রী সঙ্গে দিল চারি দুগ্ধবতী।		
বহল রমণী দিল তাহার সঙ্গতি॥		
কহিলেন রাজা তারে করি পরিহার।		
আমার তনয় নেহ তনয় তোমার॥		
চেষ্টা করি পালিবা শিখাইবা বিদ্যাগুণ।		
যেন মতে হয় অস্ত্র শাস্ত্রেতে নিপুণ॥		
রাজনীতি ধর্মকর্ম শিখাইবা ভালে।		
যেন যুবকালে ন্যায় ধর্মে রাজ্য পালে॥		
এত শুনি নেয়ামানে ভূমি চুম্ব দিয়া।		
যোগ্যতার দিয়া চলিলেন শিশু লৈয়া॥		
ইমনের দেশে বাস হেল শুভক্ষণে।		
বাল্য চন্দ্র প্রায় শিশু বাড়ে দিনেদিনে॥		
চারি বৎসরের যদি হেল রাজসুত।		
আরিভিল শাস্ত্র পাঠ গুণ বিদ্যাযুত॥		
নৃপ নেয়ামানে তবে ভাবিলেক মনে।		
নির্মিতে উত্তম পুরী পুত্রের কারণে॥		
সকল ইমন দেশ বিচারি চাহিল।		
শুদ্ধ ভূমি মনোহর স্থল এক পাইল॥		
নৃপতি কুমার তনু অতি সুকোমল।		
যথা নেহ ধিক উষ্ণ ধিক হিম স্থল॥		
চতুর্দিকে প্রান্তের পবন বেহ মন্দ।		
চিন্তাকুল মনে শীঘ্র জন্মায় আনন্দ॥		
সপলে কুষ্মণ্ডে পুষ্পিত অনুক্ষণ।		
ঋতুরাজ পুত্র সঙ্গে তথাতে মদন॥		
দর্শে অবিরাগ পরশনে উল্লাসিত।		
শতাকেত জরাজীর্ণ হয় হরিষত॥		
দিব্য স্থল পাইয়া রাজা চিন্তে মনেই।		
অনুরূপ পুরী নির্মিবেক কোন জনে॥		
অন্বেষিতে নৃপতি পাইল বার্তা সার।		
কর্মি এক আছেন্তু রম দেশের মাঝার॥		
বহু পুরী গাঁথিছে মিছির শাম রুম।		
হস্তের বাসুলা হেরি শীলা হয় মোম॥		
অতিশয় শীঘ্র হস্ত নানা গুণ জানে।		
বিশ্বকর্মা দ্বিতীয় সকলে অনুমানে॥		
বেণে গঠে যুতীয় সমান নাই তার।		
শামের বংশের জন্ম নামে ছমনার॥		
বহু দেশ ভ্রমিয়া পাইল বিদ্যা সব।		
রাজকুলে দেখি করে অধিক গৌরব॥		
কিবা রম হিন্দে আর কিবা চিন দেশে।		
তার নাম সরি কার্য হস্ত কর্ম প্রশে॥		
বিচারি নক্ষত্র গ্রহ বুঝে ভাল মন্দ।		
তিলছিমাত বিদ্যা দেখি গুণি হয় ধন্দ॥		
তারে যদি আনিয়া নির্মাণ কর পুরী।		
পবিত্র পাষাণে সব দিব কার্য করি॥		
যদি বহু প্রসাদে করহ মন তুষ্ট।		
এই পুরী হৈব সব ভুবনের শ্রেষ্ঠ॥		
এত শুনি রাজবর হেল হরিষত।		
হাকারি পাঠায় দিয়া প্রসাদ তুরিত॥		
অধিক প্রসাদে গুণি মহা তুষ্ট হইয়া।		
রাজার সম্মুখে আইল সত্বরে চলিয়া॥		
ছমনা আইল যদি নৃপতি গোচর।		
পুনরপি প্রসাদে তুষিল নৃপবর॥		
কর্মি সঙ্গে নরপতি গেলেন্তু ইমনে।		
পুরী আরম্ভেন আর পুত্র দর্শনে॥		
পুত্র মুখ দেখি রাজা হরিষ অপার।		
আজ্ঞা দিল দিব্য স্থলে পুরী গঠিবার॥		
এক মহা অমাত্য করিয়া নিয়োজন।		
পুঞ্জেই দিল বহু রজত কাঞ্চন॥		
সহস্রই কর্মি নিজ দেশে ছিল।		
লক্ষই মনিষ্য কার্যেতে নিয়োজিল॥		
বহুবিধ উট রথ গর্দভ খচ্চর।		
দিব্য শিলা আনিবারে দিল নৃপবর॥		
গড়ে আজ্ঞা পাত্রের আদেশে নরপতি।		
যেই মাসে কর্মিগণে দিতে শীঘ্রগতি॥		
নানাবিধ অস্ত্র সব তিক্ষু খরশান।		
গঠি দিল নৃপতি আপনা বিদ্যামান॥		
সহস্রই কর্মি করে সূত্র ধার।		
তেরচ বেহর তেজি করয় সুসার॥		
মৃত্তিকা খুদিয়া যদি পাইল সলিল।		
তথা হেন্তে নেও দিয়া বসাইল শিল॥		
শত হস্ত পাতন করিল হেট ভাগ।		
উপরে কাঙ্গুরা যেন স্বর্গ পাইছে লাগ॥		
শিলা মরকত মণি ফটিক পাষাণ।		
যুতিবন্তু হৈল যেন দর্পণ সমান॥		
কোন চিত্র না করি কেবল দিল যুতি।		
স্বর্ণ বর্ণ ধরয় উদিল দিনপতি॥		
অধিক সুন্দর গড় কামনা সুন্দর।		
দূর হেন্তে দেখে যেন পর্বত শিখর॥		
যেদিকে আছয় গিরি বৃক্ষ পুষ্প লতা।		
সকলের প্রতি বৃক্ষ উগে গিয়া তথা॥		
চন্দ্রোদয় সম গিরি সমান ধবল।		
যে দিকে যে বস্তু সব তথাতে উজ্জুল॥		
সন্ধ্যাকালে দেখয় ধবল গিরি প্রায়।		
এক খণ্ড বিনু চিরু চিনন না যায়॥		
নিতা চন্দ্র সূর্য গড় বন্দিয়া চলয়।		
মন ত্রাসে বাজি পাছে রথ চূর্ণ হয়॥		
তিন ক্রোশ বাট হেল গড়ের পাতন।		
চারি ভিতে চারি নদী সমান গঠন॥		
পবন চলেন জান হয় লহরিত।		
নানা বর্ণ জ্যোতি ছত্র গড়েত উদিত॥		
তিন দিকে তিন শাকু সুধীর গঠন।		
যেই যায় সেই পায় নিজ দর্শন॥		
গড়ান্তরে ফলে ফুলে রচিল উদ্যান।		
সুরঙ্গ সুগন্ধ রস সুষাদ স্থঠান॥		
রচিত কেয়ারি সব পবিত্র পাষাণ।		
নানা মতে কাটাউ জড়াউ স্থানে স্থান॥		
মহা সেরোবর তাতে সমুদ্র প্রকার।		
মৈথুন তরাসে যেন লুকিত পারাবার॥		
সূর্য মণি জ্যোতি যেন অতি সুশীতল।		
মধু মিষ্ট নীর ক্ষির জিনিয়া নির্মল॥		
ফটিক পাষাণ ঘট সব কাঁচ ডাল।		
স্থানেই হেম রত্ন জড়িত বিশাল॥		
প্রতি পুষ্করণীর জলে পুণিত কেয়ারি।		
বহয় সহস্র ধার লক্ষিতে না পারি॥		
যথা হেন্তে আইসে জল তথা পুনি যায়।		
প্রতি বিটেপর ডাল ভ্রমর সদায়॥		
মাঝেই রচিলেক বিশ্রামের স্থল।		
দিব্য বৃক্ষ ছায়া চতুর্দিকে বেহ জল॥		
সিন্ধু ভাবে ঘন করি করি বিলাসএ।		
গর্জিয়া তর্জিয়া জল টানিয়া তোলএ॥		
সুধীর সৌরভ বেহে সমীর সহিত।		
সুরঙ্গ পঙ্কীর রেবে মন উল্লাসিত॥		
সপুষ্প পল্লবে যত বৃক্ষ আরোপিল।		
তেতোধিক পল্লিবয় তাধিক ফলিল॥		
ষট পদ্ম ঝঙ্কারে সকল কঠ রায়।		
বন্দি হই মাধুরিত বহিল তথায়॥		
মাঝেই নগর প্রান্তর দিব্য ঘর।		
উচ নিচ তেরচ বর্জিত সম ঘর॥		
শিলাবন্দ নগর প্রান্তর হাট ঘাট।		
চন্দ্রমণি সূর্যমণি গঠ ভুই বাট॥		
সূর্যমণি উষ্ণ হয় তপন তাপনে।		
শীতকালে বেহ বাট সুখে নিশি দিনে॥		
গ্রীষ্মকালে তথা লোকে সুখে বাট বয়।		
সূর্য দৃষ্টি না পরশে তিলছিমাত চয়॥		
একখণ্ড শিলা প্রায় নাই ষট চিন।		
প্রতি বর্ণে নমক চমক ভিন্ন ভিন॥		
মধ্যস্থলে স্বর্গ প্রায় গঠিলেক টঙ্গি।		
এক গৃহে সপ্ত খণ্ড সপ্ত রঙা রঙি॥		
নানা বর্ণ বাছি লাগাইল শিলাকুল।		
রজত কাঞ্চন ধিক যার প্রভামূল॥		
উর্দ্ধ ভাগে স্বর্গ বর্গ লেখিল সকল।		
চন্দ্র সূর্য রাশি গ্রহ নক্ষত্র মণ্ডল॥		
ব্রহ্মা বিষ্ণু সব দেব সঙ্গে পুরন্দর।		
লেখিল অমরাপুরী বৈকুণ্ঠ সুন্দর॥		
সপ্ত স্বর্গ লেখিল যেতক তারা রাশি।		
যে লোক যেদিকে বৈসে লেখিল প্রকাশি॥		
কন্পদ্রুম সুধাকুণ্ড গজ ঐরাবত।		
উচ্চশ্রবা মারুতি পুষ্পক দিব্য রথ॥		
ব্রহ্মলোক গোলক পার্বতী পরী লোক।		
যেমর॥		
দক্ষিণ দ্বার যত দুঃখ সুখ।		
অষ্ট দেব অষ্ট বজ্র সবাহ সহিত॥		
যত ইতি স্বর্গ বর্গ সব কল স্তুতিত।		
ফিরিস্তা সকল আদি ছিদ্রা কৌছর॥		
লেখিলা বিহিস্ত হরাএন মেনোহর।		
রেজওয়ান গেলমান দরকু তুবার॥		
নিরখির মধু সুর বেহ চারি ধার।		
বিহীস্তু উদ্যান রাশি লিখিল যেতক॥		
বিচারিয়া কহিবারে নপারি তেথক।		
মধ্য ভাগে লিখিলেক খেতির পাতন॥		
অষ্ট দিকে অষ্ট গিরি কল নিরোজন।		
পূর্বেতে উদয় গিরি সুবর্ণ লিখিল॥		
পশ্চিম দিকেতে অস্তাচল আরোপিল।		
উত্তরে হেমন্ত গিরি মলয়া দক্ষিণে॥		
স্থাপিল প্রখর গিরি আনলের কোণে।		
নৈঋতে কনক গিরি বায়ুতে কৈলাস॥		
ঈশানে মহেন্দ্র গিরি লিখিল প্রকাশ।		
নবনি ও সুরা যত সাধি দুগ্ধ জল॥		
ভিন্নই সপ্ত সিন্ধু লেখিল সকল।		
যেই দিগে যেই জন্তুর নিবাস॥		
পৃথকই সব লিখিল প্রকাশ।		
সাগরের জলজন্তু আদি কূর্ম মীন॥		
একেই লিখিল মৎস্যের যত চিন।		
তক্র রবুল-আল-মীন মক্কার গঠনা॥		
বয়তল-মকদ্দশ আর লেখিল মদীনা।		
বেকছিল জবল-আরুফা গিরি নুর॥		
সর্ব পুণ্যস্থল লেখিলেক কোহতুর।		
সকল কেবলা লেখিলেক ভিন্নই॥		
যে দেখে ছিজদা করে এই তার চিহ্নু।		
অপূর্ব দর্শন সব লিখিলেক যত॥		
সংসারে অনন্ত সৃষ্টি কে কহিব কত।		
অধভাগে লিখিলেক পাতাল সকল॥		
ভূতল পতল আর নিতল সুতল।		
কিতল আতল হেটে লিখিল পাতাল॥		
নাগ লোক আদি যত যে জন্তু বিশাল।		
নানা রত্নে জড়িত অধিক দিল জ্যোতি॥		
নিশিভাগে পারয় গাঁথিতে মুতি পাতি।		
হিরার কুলুপ দিল মাণিক্যের কুঞ্জি॥		
হেম রত্নে ভরিয়া রাখিল বহু পুঞ্জি।		
কুমারের কুষ্টি হেরি সুখ বিচারিয়া॥		
যে ক্ষণে যে হৈব তাকে মনেত ভাবিয়া।		
এই সপ্ত গৃহে তারে লেখি কুতূহলে॥		
অন্তস্পট আড় দিয়া রাখিল বিরলে।		
তার পাছে লিখিলেক সপ্ত রাজ্য জিনি॥		
পরম সুন্দরি সপ্ত রাজৈকন্যা আনি।		
সপ্ত গৃহে সপ্ত কন্যা রাখি অনুরূপে॥		
নানা রূপে কেলি কলা ভুজিব স্বরূপে।		
সে সপ্ত কন্যার মুর্তি লিখিয়াছে তথা॥		
পশ্চাতে কহিব দেখি না লিখনু এথা।		
দুইবার নরপতি আসিয়া দেখিল॥		
পঞ্চম বিরেষ টঙ্গী স্বনির্মিত হৈল।		
পুরী সাঙ্গ হেল হেন শুনি নরপতি॥		
পুনরপি ইমনে চলিল শীঘ্রগতি।		
তিন দিন পথ থাকি পুরি দৃষ্টি পেড়॥		
ধিক যুতি ধরি অতি ঘনান নিয়রে।		
রাজ মোক্ষ সৈন্য মন্ত্রি ছেদ মহামদ॥		
দুঃখিত জেনের বন্ধু গুণির সম্পদ।		
রশিক নাগর গুরু জ্ঞানবন্ত ধীর॥		
উপকর্তা দুঃখ হর্তা পবিত্র শরীর।		
তাহান আরতি হীন আলাওলে গায়॥		
আয়ু যশ পুত্রে পৌত্রে বারোক সদায়॥		
## রাজা খয়ানিক পুরি প্রস্তুত করিবার বিবরণ		
*(দীর্ঘ ছন্দ — রাগ পাহাড়িয়া)*		
পঞ্চম বিরেষ পুরি ছমনায় সাঙ্গ করি।		
নৃপতিত কহি পাঠাইল॥		
শুনি নৃপ মহাবল সঙ্গে করি চতুর্দল।		
শীঘ্রগতি ইমনে চলিল॥		
স্তন্ত্র থাকি সপ্ত টঙ্গি নানা বর্ণে রঙারঙি।		
দেখি হরিষত মহারাজ॥		
যেন সপ্ত নঘ আনি চন্দ্রক তারক মণি।		
সঙ্গেত স্থাপিয়াছে খিতি মাজ॥		
মাণিক্য মৌলি করি অনন্ত অলখ ভরি।		
নঘ যুতি ধরয় নয়ান॥		
হিরার মৌল মাজ শ্বেত শ্যাম বর্ণ সাজ।		
পঠিয়াছে চন্দ্রিমা সমান॥		
মহা রত্নে দিয়া যুতি লেখি সূক্র বৃহস্পতি ক্ষুদ্র নঘ কির্তিকা চরিত।		
গৃহবাসী ভাগে ভাগে দেখি মহা নৃপ আগে অপূর্ব রহিল অখণ্ডিত॥		
জেতক নিকটে আইসে থরই সুপ্রকাশে।		
দেখি রাজা ভাবে মনেই॥		
যেন মোর পুত্রবর তেন পুরী মেনোহর।		
নঘ ভল হইল ইমনে॥		
পুঞ্চিতে প্রবেশ হৈয়া সর্ব কর্ম নিরক্ষিয়া।		
নৃপতি হরিষ নাহি ওর॥		
নাহি দেখে নাহি শুনে হেন কর্ম কোন স্থানে।		
হেরি হেরি হইল বিভোর॥		
ছমনারে সম্বোধিয়া পুনিং প্রসংসিয়া।		
হেম রত্ন দিল বস্ত্র ধন॥		
বহল প্রসাদ পাইয়া গুণি মন সন্তোষিয়া।		
আশাধিক পুরাইল মন॥		
যত্ন হেন্তে গুণ দশ পাই হেল ধিক বশ।		
কহিলেক নৃপতি বিদিত॥		
আসি দুষ্টা সরস্বতি ভ্রমাইল তার মতি।		
উচিতে হইল বিপরিত॥		
কহিলেক অনুরাগে মুই যদি জানো আগে।		
হেন দান দিবা মহারাজ॥		
মনেতে আছিল যত প্রকাশ করিতুঁ তত।		
এতাধিক করিতুঁ সুসাজ॥		
এথ শুনি নরপতি ক্রোধযুক্ত হই অতি।		
মনে ভাবে আছে নৃপকুল॥		
এহার অধিক কাম গঠি দিলে অন্য ঠাম।		
এ পুরী হইব হীন মূল॥		
কহিল নৃপতি আমি এরাক আজম স্বামী।		
আমাধিক কেবা আছে দাতা॥		
মোরে করি অল্প জ্ঞান গঠিবারে অন্য স্থান।		
ভাবিয়া না প্রকাশিলা এথা॥		
তিন কর্ম হেন্তে এক যদি কর পরেতেক।		
মোর ক্রোধে তবে রক্ষা পাও॥		
মনে আছে যথ কাম প্রকাশহ এহি ঠাম।		
কিবা হস্ত কাটিয়া ফেলাও॥		
নতুবা কিতাব ছুইয়া দিব্য কর দাড়াইয়া।		
নকরিবা এ পুরি সমান॥		
নকরিবা কোন স্থান বাণুছা বহু পাইতে দান।		
তবে পুনি তোমার কল্যাণ॥		
এ বুলিয়া ছমনারে থুইল নিয়া কারাগারে নৃপতি হইয়া ক্রোধ মুখ।		
বিচারিয়া রাণী বর্গ কিবা মর্ত্ত কিবা স্বর্গ পুরী নাম থুইল খয়ানিক॥		
রশদিধ গুণ পাল মিত্র হিত শত্রু কাল।		
গুণিযুত হৈয়দ মহামদ॥		
তান আজ্ঞা ধরি মনে হীন আলাওলে ভনে।		
আয়ু রুচি বারোক সম্পদ॥		
