আলাওল		
বাদর যামিনী, একাক্ষর কামিনী, ঝুরিং মরহ বৈরাগী।		
সঘন ঘটাঘট, বিজলী ছটাছট, দশদিশ বিরক্ষর আগি॥		
কুটের কানন মহা, কাতর হরিণী, বিরহ যায় রজনী।		
নিকট মদন, দিপীছয় নাহি খায়, অয় নম মন্ত বাণী॥		
কুঞ্জর দ্বিতগ, শরীর ধংসময়, নেহ সিংহ বিনু পাসা।		
অহিনিশ রঙ্গিনী, সতত উত্তাপিনী, কেন পুরাইব আশা॥		
নাথ অনাদের, আনল সাগরে, যোর পরয়েছো জনে।		
ছৈয়দ মহাম্মদ, যুগে যুগে জিউক, হীন আলাওলে ভনে॥		
*(জমক ছন্দ)*		
এই মেতে বাহরাম নানা ক্রীড়া রঙ্গে গোঙাইল চিরকাল দেলারাম সংগে।		
নিজ মিত্র নইমেক এরাকে পাঠাইয়া॥		
আপেন রহিল সুরা শিকারে ভুলিয়া।		
এক রদ্ধ অমাত্য বরিছি তার নাম॥		
তার হস্তে সপিল তেতক রাজ কাম।		
দারার বংশেতে জন্ম নৃপতির ইষ্ট॥		
অন্তরে কুটুষ মাত্র না হয় ঘনিষ্ট।		
মহা বুদ্ধিমন্ত রাজ কার্যেতে কুশল॥		
যত ইতি রাজ কর্ম জানয় সকল।		
তিন পুত্র হয় তার যোগ্যবত্ত অতি॥		
নানা গুণে পারগ বুঝয় সর্ব নীতি।		
জরাওর্দ নামে তার প্রথম তনয়॥		
তার যুক্তি বিনে নৃপ কিছু না করয়।		
ধন রত্ব আদি মান সাগরের কর॥		
মধ্যেমর হস্তে দিল যেতেক দপ্তর।		
হয় হস্তী আদি যত ইতি সৈন্যগণ॥		
সভার লস্কর করি দিল ছোট জন।		
চারি জন হস্তে সব কার্য সমপিয়া॥		
আপেন রহিল সুরা শিকারে ভুলিয়া।		
এক ঘরে চারি ভাগে যত ইতি কাম॥		
কেবল নৃপতি নাম ধরে বাহরাম।		
মহা পাত্র বরুচির যেই হয় ইচ্ছা॥		
মিথ্যারে করয় সত্য সত্যরে করে মিছা।		
পুর্বে বৈরী ভাব যার কিছিৎ আছিল॥		
সকল উদ্ধারি নিজ গুণ বাড়াইল।		
যুদ্ধ সৈন্য মাগিয়া নপায় নিজ বিত্তি॥		
সংসারে ভরিল বাহরাম অপকীর্তি।		
ছলে বলে নৃপ এই হারাইল জ্ঞান॥		
স্বরার কোটরা মাঝে রাখিল কৃপাণ।		
সব সৈন্য নৃপ হস্তে ফিরাইল মুখ॥		
ঈশ্বর থাকিতে কেনে লোকে পায় দুখ।		
প্রতি দেশে প্রসরিল এই সমাচার॥		
বাহরাম শক্তিতে রাজত্ব নেহ আর।		
চীন দেশ নৃপতি খাকান তার নাম॥		
শুনিয়া সাজিল সে মারিতে বাহরাম।		
তিন লক্ষ অশ্ববার করিয়া সঙ্গিত॥		
জয়তুন নদী পার হৈল শীঘ্রগতি।		
জায়রুজ্জহর দেশ বেলেতে আসল॥		
খোরাছান দেশ মধ্যে ক্বল্কুল হৈল।		
বল বুদ্ধি নইম বাহির না হইয়া॥		
রহিল এরাক গেড়ে দুয়ার বান্ধিয়া।		
কর্ম অনুরূপ লেখি নিবেদিল পাতি॥		
বাহরাম স্থানে পাঠাইল শীঘ্রগতি।		
ইমেন রহিয়া পাত্রে বুঝি কার্য রীত॥		
বিমর্শণ করে তিন পুত্রের সহিত।		
খাকান নৃপতি পাশে পাঠাইল পত্র॥		
সর্ব পরে উচ্চ হোক নৃপতির ছত্র।		
হতবুদ্ধি হইল যে নৃপ বাহরাম॥		
কদাচিৎ তান হস্তে নেহ নৃপ কাম।		
নৃপতির সেবায় জানিও নিজ লাভ॥		
আমি সব তোমাতে হইল আপ্ত ভাব।		
যদি মাগ বাহরাম শির কাটি দিব॥		
নেহত বান্ধিয়া আনি সাক্কাতে করিব।		
খাকানের আগে বার্তা আইল শীঘ্রগতি॥		
পত্র পাঠে সমস্ত শুনিল নরপতি।		
খোরাছান নরহি ইমন ঘুখি ধাইল॥		
মনে ভাবি বাহরাম পাইলে সব পাইল।		
নইমের পত্র ইমনেতে গেল যবে॥		
শুনি বাহরাম সাজিতে হৈল তবে।		
গুপ্ত জ্ঞাত চর সব জিজ্ঞাসিতে আনি॥		
বলিল সকল মন মরম কাহিনী।		
বুঝিল সৈন্যের মন হইছে বিরোধ॥		
খল জন প্রত্যাপ্ত হইল কর্কশ।		
পাঠেতে রহন মোর না হয় উচিত॥		
আত্তু কুল সঙ্গে নিষ্মরণ মাত্র হিত।		
দিন ইছলাম ভাগ্য সাহেসর বেলে॥		
ভাবি নিষ্থিরল রাজা যুগযার ছেলে।		
নিজ সৈন্য তিন শত হাবেশি কিঙ্কর॥		
ধনুর্বাণ অস্ত্রে বাহরাম সমস্বর।		
আর যত নিয়মিত আছে রাজ সাজ॥		
সঙ্গে করি প্রবেশিল মহারণ মাজ।		
বাছিং অশ্ব সব লৈল বায়ু গতি॥		
গিরি বন জলে পক্ষী জিত শীঘ্রগতি।		
ছুরেতে রহিল গিয়া কানন নিকটে॥		
দশ দিন হৈল নৃপ নআইল পাটে।		
হতবুদ্ধি পাত্রগণ ভাবি লৈকল সার॥		
বাহরাম ধাইল কণ্টক নাই আর।		
বার্তা পাঠাইল শীঘ্রে খাকানেতে চর॥		
দেশত্যাগি হৈল বাহরাম নৃপবর।		
তুরিতে আসিয়া লও নিষ্কণ্টকে পাঠ॥		
শুনি এক দিনে আইল তিন দিন বাঠ।		
শান্ত হৈয়া খরং রেহ কছ সৈন্য॥		
বেগমস্ত হয় মাত্র সঙ্গে অস্ত্র গণ্য।		
অশ্ব সব শান্ত হৈয়া পুছ না দোলায়॥		
পরিশ্রমে সব সৈন্য ব্যাপিত নিদ্রায়।		
বাহরাম স্থানে শীঘ্রে জানাইলে বার্তা॥		
যেন মেতে শীঘ্রে আইসে চীন দেশ কর্তা।		
বাহরাম জৌতিষ গণিয়া নানাবিধি॥		
কাল দেখি বুঝিল বিজয় কার্য সিদ্ধি।		
সেথা হস্তে পক্ষ দিন ইমনের গড়॥		
নিঃশব্দে রহিল আসি প্রান্তর নিয়র।		
শীঘ্র চলি কান্দার উত্তম বনখণ্ড॥		
যথা হস্তে বাঠ আসি লংঘে চারি দণ্ড।		
বাহরাম স্থানে আসি চরে দিল জান॥		
সৈন্য সাজ করি নৃপ হৈল আগুয়ান।		
রাজ সাজ সঙ্গে আছে সহস্র কর্ণাল॥		
সপ্ত শত ঘোর শব্দ ঢুমঢুমি বিশাল।		
এক শত পাট হস্তী ঝাড় তিন লাট॥		
যারং গেসে অন্য হস্তী না আইসে নিকট।		
দাউদি জেরাই গায় নানা তাস্ত্রধারী॥		
লৌহময় বর্মা অঙ্গে যত হয় করি।		
উত্তম হাজার মেখি কেজিম বেষ্টিত॥		
দো-রেকাবি অশ্ব সব গতি বায়ু জিত।		
খরতর ধাপে যদি চলে অষ্ট জাম॥		
মহত্ত এরাকি অশ্ব নেহ মন্দ গাম।		
চতুর্থ দর্পণ অঙ্গে লৌহময় জেল॥		
বেষ্টিত ঘাগর ঘণ্টা গজেন্দ্র বিশালে।		
তিন ভাগে হৈল তিন শত আছোয়ার॥		
কর্ণাল ঢুমঢুমি হস্তী সঙ্গে দিল তার।		
নয়মান দক্ষিণ বামেত ছরহংস॥		
মধ্য ভাগে আপিন রহিলা রিপু ভঙ্স।		
দুই দিন পক্ষ ভাঙি যায় যার যার বাণ॥		
তিন শত হাবসি হইল আগুয়ান।		
ছরহংস নিজ সৈন্য হৈল পৃষ্ঠ গোপ॥		
অগ্র সৈন্য বাছিয়া লইয়া আদি রোপ।		
নিশি চিহ্নু নিয়ম বচন কহি সার॥		
বুঝিয়া মাহিন্দ্র যেন হৈল আছোয়ার।		
ঘড়িয়ালে পিটিলেক দোরাদশ দও॥		
চলি গেল বাহরাম সংগ্রামে প্রচও।		
পথে যাইতে সব বাদ্য-ভাওে কৈল মামা॥		
অর্দ্ধ রাত্রি নিয়মিত দিতে কৈল হানা।		
এই মতে ধীরে ধীরে হইয়া নিকট॥		
তিন ভাগে রহিলেক হইয়া প্রকট।		
খাকানের সৈন্য সব মহা শান্ত হৈয়া॥		
নিশকে রহিছে সবে অস্ত্র তেয়াগিয়া।		
পাট হৈতে ধাইল পাগল নরপতি॥		
এই বার্তা শুনি নাই যুদ্ধের আরতি।		
ব্রহ্মা তেয়াগিয়া অঙ্গে পরিপাট বস্ত্র॥		
হস্তি উট হৈতে নামাইছে অগ্নি অস্ত্র।		
ঘড়িয়াল দও যদি পিটিল দ্বিজাম॥		
তিন ধারে ধারি কৈল নৃপ বাহরাম।		
গগম পুরিল শব্দে ডুমডুমি বিশাল॥		
ইস্রাফিল সিঙা সম ফুকিল বিশাল।		
হস্তির চীৎকার ঘণ্টা যাগরের শব্দ॥		
অধে উর্ধে রহিল বাণিক শুক্র স্তব্ধ।		
বড় বড় কামান বন্দুক শতেৎ॥		
একবারে সমস্ত ছুটিল তিন ভিতে।		
তিন শত আছওার হই আঙুয়ান সিংহনাদ করি সবে গ্রহিল কামান॥		
একবারে আসি যেন ঘটিল প্রলয়।		
যোগ পরিবর্ত্ত সম পড়িল সংশয়॥		
অগ্রগামী সৈন্য সব পড়িল বহুল।		
জার প্রাণ উবরিল ত্রাসেতে ব্যাকুল॥		
ব্রহ্মা চড়াইতে অঙ্গে কেহ নপারিল।		
শূন্যগায় বীর সবে অথে আরোহিল॥		
বীর্যশালী বীর যত হয় অগুয়ান।		
বাহরাম বানে বিন্দে কুষণ সমান॥		
ছুটি তিন জন-ভেদি যায় এক শর।		
মহা ত্রাসে যোদ্ধা সব হইল কাফর॥		
বাহরাম নিকেট না আইসে কার বান।		
যেই জন আঙু হয় হারায় পরান॥		
শোণিতে কর্দম হৈল সব রণভূমি।		
ত্রাসে ভঙ্গ দিল যত বীর অগ্রগামি॥		
বাহরাম অশ্ব সব অতি শীঘ্রগতি।		
পৃষ্ঠে পৃষ্ঠে আসি করে সৈন্যর দ্রুগতি॥		
খড়্গ হানি কার অঙ্গ করে দুই খও।		
পরষ্পরাঘাতে কারো দারা করে রণ॥		
ছেল হানি প্রাণ শূন্য করে কার অঙ্গ।		
বাপে পুত্র না চায় পড়িল মহা ভঙ্গ॥		
অধুবার পরিমুক্ত ভ্রমে অশ্বগণ।		
বাহরাম পদাতি করয় আরোহণ॥		
পৃষ্ঠভাগে ছরহঙ্গ নিজ সৈন্য সঙ্গ।		
জানিয়া ডিয়টিকুল কৈল তম ভঙ্গ॥		
পদাতি সহত্র শঙ্কা হইয়া সওার।		
পৃষ্ঠ ছাড়ি আইসে শব্দ করি মার মার॥		
অগ্রগামী সৈন্য সব বহুল পড়িল।		
অব-শিষ্ট মধ্যের সৈন্যে প্রবেশিল॥		
মধ্যভাগে আছে আপে নৃপতি খাকান।		
সর্ব সৈন্য সাজিয়া হইল আঙুয়ান॥		
হস্তি পেরে আর বাওলিতে নপারিল।		
অথে চড়ি চর ভাবে রণে প্রবেশিল॥		
না লই সকল অস্ত্র অঙ্গ ব্রহ্ম হীন।		
তৎমাত্রে অশ্ব পৃষ্ঠে চড়াইল জিন॥		
যেই যেই অশ্ব সব আছিল ঘণান।		
বিনা ব্রন্ধে সে সব হইল আঙুয়ান॥		
বাহরাম আসি শীঘ্র খাকান সমুখ।		
একবারে সহত্র কর্ণালে দিল কুক॥		
সপ্ত শত ডুমডুমি একত্রে দিল বাড়ি।		
যোগ পরিবর্ত যেন কম্পে মৈত্রিগিরি॥		
হস্তি সব চীৎকারে বীরত্ব সিংহনাদ।		
হটিয়া আরব কুল পড়িল প্রমাদ॥		
তিন শত বীরে যে গ্রহিল ধনুর্বান।		
জার বানে হস্তি হানে মেণুক সমান॥		
এক যায় ভেড়ী যায় তিন চারি জন।		
অকস্মাৎ বজ্রপাত যম দর্শন॥		
তিন শত শীঘ্র হস্ত অব্যর্থ ধানুকি।		
যেন ধনঞ্জয় শিষ্য মহত সার্থকী॥		
হতি কুতে শরারন্তে পুচে নিথরয়।		
যেই অঙ্গে বান লঙ্ঘে তিল না দোলয়॥		
সে সবার পাশে কার না লংঘয় বান।		
দেখি অতি হতমতি হইল খাকান॥		
যত সৈন্য অগ্রপণ্য থেতি বিলোলিত।		
যেই পাছে রহিয়াছে পাই মহা ভীত॥		
বাহরাম বান শব্দ শুনিলে অবণে।		
ভাবিল নাহিঙ্ক জুয় অঙ্গুরের রণে॥		
যুদ্ধাপতি সব প্রতি কহিল খাকান।		
মিশাইয়া যুদ্ধ দেও ধরিয়া কৃপান॥		
হস্তি গর অশ্ব দড় করি দেও ধর।		
যুদ্ধে পশি মিশামিশি সবে মার বেড়ী॥		
নরপতি অনুমতি বীরভাগে শুনি।		
বহ করি আগে ধরি করিল উঠানি তথাপিহ বাহরাম শর না এড়য়॥		
আসিয়া লংঘিতে সৈন্য অর্দ্ধ কৈল ক্ষয়।		
যেই হস্তি শর খায় রেহ সেই স্থান॥		
ত্রাসে চমকিত কেহ নেহ আঙুয়ান।		
হস্তি পেরে অশ্ব পেরে না সহয় সৈন্য॥		
নির্ণাম করিল যত বীর অগ্রগণ্য।		
একবারে পড়য় সহত্র সিংহ বীর॥		
মহা ভয় পাই কেহ রণে নেহ স্থির।		
অযুতেৎ সৈন্য খাকানের কাছে॥		
সহত্র পড়য় ভূমে ছিদসহত্র আইসে।		
তা দেখিয়া বাহরাম শরীর নির্ভিত॥		
প্রবেশিল সৈন্য মেধ্য সংগ্রামে পিণ্ডিত।		
এক শত মত্ত হস্তি টোকাইয়া রোয়ে॥		
ব্রহ্মা-অস্ত্র কু-অস্ত্র যে অঙ্গে না প্রবেশে।		
জঙ্গি অশ্ববার সব সংগ্রামে প্রচুর॥		
দাউদি জিরাই অঙ্গে বীর্যবন্ত স্বর।		
অশ্ব অশ্ববার অঙ্গে অস্ত্র না ফুটয়॥		
তীক্ষ্ণ অস্ত্র ধারি সব বেগবন্ত হয়।		
একবারে সৈন্য মধ্যে প্রবেশিল আসি॥		
বীর সব মুণ্ড কাটে হানি তীক্ষ্ণ অসি।		
হৈতে চর্ম অঙ্গে ব্রহ্মা অক্ষয় শরীর॥		
মস্তকে হানিয়া ঘাও করে দুই চির।		
গুরজ মগড়ুর আদি হানী তীক্ষ্ণ বান॥		
মুশল পরিল ভগ্ন আদি ভিত্তি গান।		
নারচ ওম্বর খড়্গ গুরজ সম্পর॥		
আর নানা অস্ত্র ছেল খাপুরা ঝামর।		
নানা তত্ত্র হানী সৈন্য করয় নিপাত॥		
সে সবের অঙ্গে না প্রবেশে অস্ত্রাঘাত।		
অক্ষয় শরীর বাহরাম বলবান॥		
এক ঘাওে লয় মত্ত হস্তির প্রাণ।		
দুই হৈতে খড়্গ লই সৈন্য বিলরয়॥		
দেখি তাহা রিপু সৈন্য পাইল মহা ভয়।		
হস্তী যত আসিয়া হইল অগ্রগণ॥		
বিলরিল বহুবিধ খাকানের সৈন্য।		
খাকানের হস্তি সব চৌদিও না হৈয়া॥		
রণে ভঙ্গ দিল নিজ সৈন্য বিশঙ্কিয়া।		
হস্তি ভেঙে সৈন্যেত পড়িল মহা ভঙ্গ॥		
বিশেষ বীরত্ব আসি বিজুলি তরঙ্গ।		
পৃষ্ঠ গোপে ছরহংগ সৈন্য সংগে করি॥		
বাহিনী মঙ্গলে আসি বিক্রমে কেশরি।		
রক্তশ্রোত বহয় জান্তিক সৎকরয়॥		
উড়িয়া কবন্ধ কুল শূন্যেত নাচয়।		
উর্ধ্বক্ষেত্রে ক্ষেত্রপাল ডাকে পুনি পুনি॥		
মাংস ভক্ষানন্দে নাচে ডাকিনী যোগিনী।		
সৈন্য ভঙ্গ দেখিয়া খাকান চমকিল॥		
বহুল যতন করি রাখিতে নারিল।		
মনে ভাবে পাত্রে পত্র লেখিল কপেট॥		
ভ্রমাই আনিয়া মোরে পড়িল সংকেট।		
প্রমাদ পড়িল এবে নাহিক নিস্তার॥		
এ সময় বীরপনা শরীর উদ্ধার।		
এথেক ভাবিয়া মনে যুক্তি দড় করি॥		
ভঙ্গ দিল খাকান সমর পরিহরি।		
রাজসাজ বস্ত্র যত অস্ত্র রত্নধন॥		
চলিল সকল তেজি রাখিয়া জীবন।		
সেই স্থানে আছিল খাকান নরপতি॥		
আসি দাওাইল বাহরাম মহামতি।		
হেন কালে সূর্যোদয় হইল প্রভাত॥		
ভঙ্গ দিল তারক মলিদ তার নাথ।		
বহুল ঘোটক হস্তি ধন রত্ন চয়॥		
ব্রহ্ম গৃহ উয়ার আনন্দ হেমময়।		
প্রভুভাবে শোকরানা করিয়া নমাজ॥		
বহিল বিজয় বাদা ভরিয়া সমাজ।		
হয় করি জন্তুরে ভুঞ্জাই নানাবিধি॥		
নিশৌ শান্ত কৈল দিয়া নানান ঔষধি।		
নিজ সৈন্য সংগে ছরহংগে কৈল আগে॥		
নয়মান মেধ্য আপে রহি পৃষ্ঠ ভাগে।		
শান্ত নৃপতির সৈন্য পৃষ্ঠে যত পায়॥		
প্রাণে না মারিয়া সব বন্দনে রাখয়।		
এরাকের পাটে থাকি নইম জত্তনে॥		
পত্র লেখি পাঠাইল বাহরাম স্থানে।		
তুখমি লিখিয়া পাঠাইল ফরমান॥		
গোপজ্ঞাতা চর সবে মিত্য দিতে জান।		
আমি আসি যুদ্ধ নিশি দিব তার আগে॥		
তুমি গিয়া ছাপিয়া তাহার পৃষ্ঠভাগে।		
যদি ধায় পৃষ্ঠে পৃষ্ঠে পিছে লাগ লেও॥		
নেহ সাবধান হই সংগ্রাম করিও।		
এই পত্র পাইয়া নইম মহা বীর॥		
সৈন্য সমাদিত হৈল গেড়ের বাহির।		
খাকানের ভঙ্গ কথা শুনি চর মুখে॥		
পৃষ্ঠে পৃষ্ঠে দেখিয়া চলিল মহা সুখে।		
বহু হস্তি ঘোটক সামন্ত রত্ন ধন॥		
পৃষ্ঠে পৃষ্ঠে বহল হইল বিলোটন।		
অবশিষ্ট সৈন্য সংগে নৃপতি খাকান॥		
জয়তুন নদী পার হৈল তূরমান।		
একবার নৃপ সংগে যথ হৈল পার॥		
সেই মাত্র উত্তরিল মরি করতার।		
পুনর্বার সৈন্য আসি না লংঘিতে ঘাটে॥		
নইম আসিল শীঘ্রে জয়তুন তেটে।		
পার হৈতে না পারি যেতক বীর গণ॥		
সবে মিলি অস্ত্র ফেলি পড়িল চরণ।		
নইমে আশাবী সৈন্য নিরমে রাখিল॥		
