আলাওল		
আপনা পৈত্রিক তুষি কর করতেল।		
ক্ষেমা কৈকেলে অযোগ্যতা ঘোষিব সকলে॥		
জমশেদ কায়উছ নওসেরঙান।		
বংশাক্রমে সেবে বসিছে এই স্থান॥		
অন্য বংশে এই পাট কেলে পরসন।		
অন্য গৃহি পাষে যেন হরে উৎকাসন॥		
মোর বাপে রাজত্ব করিত মত ভাবে।		
আপনার কর্তা হেন ভাবিলেক জেবে॥		
আপনায় ভাবি আমি কর্তার কিঙ্কর।		
পিতার আমার মেধ্যে অনেক অন্তর॥		
ঈশ্বরের ভাব আর ঈশ্বরতা ভাব।		
বুঝি চাহ বহ মেধ্যে কার আছে লাভ॥		
ব্যাপিত আছয় সব যোগ্য যোগ্যাধিক।		
ছিপিতে আছয় মুক্তা শীলাতে মাণিক॥		
সর্বোধিক বল মোর দীন ইছলাম।		
নয়মান নহি আমি নৃপ বাহরাম॥		
তুমি সেবে পালিয়া করিল মহা পাত্র।		
না হৈল প্রতিষ্ঠা যোগ্য নিন্দা চর্চা মাত্র॥		
তুমি সব বচন পালিলা অনুক্ষণ।		
তখন না কহি এবে নিন্দ অকারণ॥		
ভাল মন্দ যত কর্ম মন্ত্রী সে জানয়।		
মন্ত্রী বাক্য রথা নারে করিতে রাজায়॥		
যাহার লবন খাই গৌণাইলা কালো।		
তাকে মন্দ বল মোরে কি বলিবা ভাল॥		
আপনাকে ভাল হেন গর্ব লোকে ভাবে।		
করয় অযোগ্য কর্ম সংসারের লাভে॥		
ঈশ্বরের স্থানে বৈবেদে চিন্তি নিজ লাভ।		
মাতৃ সম জানি সেবে করে কাম ভাব॥		
এতাধিক সংসারেতে কি আছে সুকর্ম।		
পরিছেদ্রে দৃষ্টি না বিচারি নিজ মর্ম॥		
যদি মন্দ করিল শোভিল ভাল রিত।		
মৃত্যু অবশেষে চর্চা না হয় উচিত॥		
যে যেমত করয় পাইব রতু ফল।		
নিয়োজিত ঘেট তাহে নাহি বলাবল॥		
এ বচন মর্ম জানে বুদ্ধিমন্ত জনে।		
মন্দ কথা মন্দ বার্তা মন্দ শ্রোতা গুণে॥		
মন্দ কৈকেলে ক্ষেমে হেন আছয় দয়াল।		
ছিদ্র বার্তা হেন্তে তার মন্দ হয় ভাল॥		
পরিছদ্র আতি করি স্থানে যেই জন।		
এই দুই হেন্তে সৈই অধিক ভার্জন॥		
যদ্যপি শিকার সুরা নিদ্রা খেলা রস।		
স্ব-পাত্রের গুণ মোর সর্ব জন বস॥		
নাকি মোর পিতার কু-পাত্রে রক্ষা লাগি।		
বংশে নেহ অন্য জন হয় বাক্যভাণি॥		
নাস্তি সেবা নৃপ সত্য তার নাহি ফল।		
যথা তথা তাহার শ্রে জান অমঙ্গল॥		
যদি হই নিদ্রাত প্রবল ভাগ্য জাগে।		
কে আছে দাঙাইব যুদ্ধে বাহরাম আগে॥		
সুরাপান হেন্তে আমি না হই চঞ্চল।		
উতঙ্গ ভাগ্যের আগে স্মতি নিচল॥		
প্রেম পন্থে আইলে মোর ধিক প্রেম ভাব।		
ভজ মনে ধনে প্রাণে নভাবিয়ে লাভ॥		
গত অপরাধ আমি না করি ধারণ।		
সমুচিত কার্য মাত্র না রেহ পরান॥		
অথণু কুবুদ্ধি হৈলে দৈও রুত ফল।		
সুবুদ্ধি হইলে চিন্তা নাহি তার কুশল॥		
মেই নৃপ দেশবাসী সুখে নিদ্রা যায়।		
অবিরত রস নিদ্রা তাহার যুরায়॥		
লভ্য দরশায় যদি মন্দ আছে দাতা।		
ধর্মধুরি কদাপি না ধরে তোর কথা॥		
পারিতে বিগ্রহ আশা মেনত না ধর।		
সতত ঈশ্বর আগে লজ্জা ভয় কর॥		
নররূপে শৃজি যে করিছে নরপতি।		
তার আজ্ঞা বিনে মোর আন নাহি গতি॥		
প্রাপ্তি হেন্তে কার না করিয়ে গণা হানী।		
তার অনুরূপে তারে ধিক দিতে জানি॥		
যদি অবশেষ হৈল নৃপতি বচন।		
পত্র লই রায়বার চলিল তখন॥		
তুমি শির আরোপিয়া করি নমস্কার।		
নিবেদিতে লাগিল বচন পরিহার॥		
বংশ অনুক্রমে আমি তোমার কিঙ্কর।		
অপরাধ ক্ষমাকারি তুমি সে ঈশ্বর॥		
চিরজীবী হও তুমি সকলের নাথ।		
কার শক্তি দাঙাইব তোমার সাক্ষাৎ॥		
কয়রচ দারা রহমান বংশ তুমি।		
অন্য বংশ কদাচিত না সেবিব আমি॥		
নৃপ এথা না আসিব এই ভাবি মনে।		
অনুচিত করিল কুবুদ্ধি পাত্রগণে॥		
তোমা ছাড়ি অন্য সেবা কাপুরুষ আশ।		
কিন্তু সত্যে বন্দি হৈছি আমি তার পাশ॥		
মেনেতে ভাবিয়া আজ্ঞা কর মহারাজ।		
রেহ যে আমার সত্য সিদ্ধি হয় কাজ॥		
নৃপে বলে বুঝিল সবার মন মর্ম।		
সত্য না রাখিলে হয় অঙ্গুরের ধর্ম॥		
সত্য পালেকর প্রতি মোর তুষ্ট মন।		
কহিও আমার এক নিয়ম বচন॥		
অযোগ্য সহিতে নারি কার্য মহাভার।		
যদ্যপি তোমার বুদ্ধি কিসের আমার॥		
ঠেকেটর জাল সূত্র বিবর দ্বয়ারে।		
ভুজগর প্রবেশিতে রাখিতে না পারে॥		
যদি বা অনন্ত সর্প নাগকুল নাথ।		
গর্ব না রহয় তার গরুড় সাক্ষাৎ॥		
মেষরাশি অরুণ হইলে দিনপতি।		
তথাপি তাহার পুনি হয় মন্দ যুতি॥		
আরব আজম এক নৃপতির রাজ্য।		
নিজ সৈন্য নাশ হৈব যুদ্ধ কোন কার্য॥		
বলবন্তু দুই ব্যাঘ্র যুদ্ধস্থলে আনি সর্ব লোকে দেখুক হইয়া অস্ত্রপাণি।		
মধ্যস্থলে রাখি রুদ্ধ নৃপতির তাজ॥		
পদগতি সেবা নিতে পারে তার তাজ।		
পৌরষতা দেখা যাউক না হৌক নষ্ট প্রজা॥		
যাহারে ঈশ্বরে দেয় সে হউক রাজা।		
নেহ এথা আনি তাজ দিব অন্য শিরে॥		
ইচ্ছা হৈলে দিমু সুখে মোরধিক বীর।		
এত শুনি রায়বার ভূমে চুষ দিয়া॥		
নিজ স্থানে গেল পাত্র সার বার্তা লৈয়া।		
##  দুই নৃপবেরের যুদ্ধ এবং তাজ হরিবার বিবরণ		
*(দীর্ঘ ছন্দ — রাগ ছুহি)*		
শুনি বীরবর কথা, পাত্রগণ হেষ্ট মাথা, দেখি শুনি বাহরাম শক্তি।		
আদ্যের লবণ স্বীরি, যোগ্যাযোগ্য মেনে ধরি, বসি চিতে উপার্জিল ভক্তি॥		
সেবে মিলি বিমর্শিয়া, কিছিরা সাক্ষাতে গিয়া, পড়িল পত্রের পড়ুত্তর।		
শত্রুর সাহস গুণি, নিজ শক্তি হীন মানি, অতি ত্রাসে কম্পিত অন্তর॥		
মনে গুপ্ত নরাখিয়া, কহিলেক প্রকাশিয়া, রাজত্বে নাহিক মোর কাম।		
যুদ্ধে নেহ তাসমান, নিশার্থে হারাইমু প্রাণ, যেই ফান্দ কৈল বাহরাম॥		
ভাবি বুঝিলাম নিষ্ট, রাজ্য হেন্তে প্রাণী মিষ্ট, অকারণে দিতে ব্যাঘ্র হাতে।		
চাহিলুং করিতে রণ, না বুঝি সৈন্যের মন, কে জুঝিবে ঈশ্বর সাক্ষাতে॥		
দেশের যত জন, ছিল মহা পাত্রগণ, সব আসি ভজিল চরণে।		
মিলিল অনেক দল, যুঝিণু হৈলুং হীন বল, যে আছে মিলিল দরশনে॥		
পৈতৃক ধরণী তার, আমি সব পরিচার, যুবেকর শোভামান রাজ্য।		
উপস্থিত তপকাল, কেনে মোর এ জঞ্জাল, যোগ্যাযোগ্য বিচারিল কার্য॥		
আমত্য সকলে গুণি, বলে শুন নৃপমণি, কোন চিন্তা নভাবিও চিতে।		
আমরা সকল জনে, বসাইব সিংহাসনে, নিজ বুদ্ধি না পারি করিতে॥		
থাক হরিষত মন, করিছে উত্তম পণ, দ্বিপিযুগ মেধ্যে রাখি তাজ।		
কিবা ব্যাঘ্র বধ করে, কিবা ব্যাঘ্র হেন্তে মরে, নিষ্কণ্টকে পাইবা দ্বিরাজ॥		
অসীম সাহস করি, যদি নিতে পারে হরি, তবে তারে প্রসন্ন বিধাতা।		
নেহ এই অল্প কাজ, প্রাণপণে পাইলে রাজ, বাহরাম মানিব সর্বথা॥		
এই যুক্তি করি সার, দুই ব্যাঘ্র আনিবার, আজ্ঞা কৈল আখেটী সেবের।		
বলবন্তু মহা কায়, দেখি ত্রাস লাগে গায়, ক্রোধযুক্ত অক্ষত শরীরে॥		
সাধু দশ লোক সদায়, কৃপাশীল গুণালয়, শ্রীযুত ছৈয়দ মহাম্মদ।		
হীন আলাওলে কহে, সুকর্মে যাবৎ রহে, আয়ু যশ রিদ্ধি স্বসম্পদ॥		
*(জমক ছন্দ — রাগ পাহারি)*		
আখেটী সকলে নৃপতির আজ্ঞা পাইয়া।		
বলবন্তু দুই ব্যাঘ্র আনিল বাছিয়া॥		
মহা ভয়ঙ্কর দুই প্রগাঢ় শরীর।		
যার শব্দ দর সে দ্বিরদ নেহ স্থির॥		
নিয়ম দিবস যদি উপস্থিত হৈল।		
যুদ্ধক্ষেত্রে দ্বিপিযুগ আনিয়া রাখিল॥		
দুই ব্যাঘ্র হইবেক বহ আত্মা হানি।		
ব্যাঘ্র এক আনিলেক দোসর বাঘিনী॥		
একদিন এক রাত্রি নিদল আহার।		
প্রভাতে রাখিল রণক্ষেত্রের মাঝার॥		
দুই নৃপ আইল তথা সৈন্য সমহিত।		
অস্ত্র হাতে সকলে রহিল সচকিত॥		
ব্যাঘ্রপাল চতুর যদি সে আজ্ঞা পাইল।		
ব্যাঘ্র যুদ্ধ মেধ্যে রতু কীরিট রাখিল॥		
কিছিরার সম্বাদ আসিয়া এক হেন্তে।		
প্রণামিয়া কহে বাহরামের সাক্ষাতে॥		
সহজেই রুদ্ধ আমি জরাজীর্ণ কায়।		
প্রথমে হরিতে তাজ তোমার যুরায়॥		
এত শুনি ইষৎ হাসিয়া বাহরাম।		
কহিল বুঝিলুং আমি তার মনস্কাম॥		
বহ দৃষ্টা বহ শ্রোতা এরাকের পতি।		
বিশেষতঃ বৃদ্ধতমা আমি শিশুগতি॥		
বাইশ বৎসর মাত্র বয়স আমার।		
তাহান উচিত আগে তাজ হরিবার॥		
তবে যদি আমা প্রতি হাস্কারহ আগে।		
আর কি বিক্রম দেখাইবা শেষ ভাগে॥		
দিন ইচ্ছিলাম আর আয়ু ভাগ্য বলে।		
মোর বীর দর্প আজি দেখহ সকলে॥		
এ বলিয়া অশ্ব হেন্তে লামিয়া ভূমিতে।		
সিংহগতি চলি গেল দ্বিপীযুগ ভিতে॥		
যেই জনে শত ব্যাঘ্র মারিছে লীলায়।		
সে কেনে রহিব দুই ব্যাঘ্রের শঙ্কায়॥		
বায়ুগতি বাহরাম ব্যাঘ্র মেধ্যে গিয়া।		
বিজুলি ছটকে চলিলেক তাজ লৈয়া॥		
ব্যাঘ্রযুগ ভুকিল ধাইল পাছে২।		
ঘনাইতে না পারিল বাহরাম কাছে॥		
তাজ শিরে দিয়া ফিরি আসিয়া ঘনান।		
একে২ লৈল দোহান প্রাণ॥		
শীঘ্র আসি হৈল পুনি অশ্বে আরোহণ।		
বাহরাম শকতি দেখিয়া বীরগণ॥		
কিছিরা অমাত্য আদি সৈন্য সমুহিত।		
প্রণাম করিল আসি পড়িয়া ভূমিত॥		
বলিলা আরব ছত্র টিঙ্গির মায়ায়।		
কদাচিত নৃপ নাই আসিতে এথায়॥		
তেকারণে আমি সেবে কৈল এই ছল।		
বিশেষতঃ আজ্ঞা বিনু হয় বলাবল॥		
এখানে পিতৃর পাটে বৈস গিয়া তুমি।		
পুরুষানুক্রমে তোমা সেবক যে আমি॥		
বাহরামে গত কর্ম না রাখিয়া মনে।		
পাত্রকুলে প্রসাদে তুষিল জনে২॥		
নানাবিধ সুমঙ্গল করি গীত নাটে।		
আসিয়া বসিল নৃপ এরাকের পাটে॥		
শ্রীযুত ছৈয়দ মহাম্মদ রসিসিন্ধু।		
গুণিজন পাল ধীর দুঃখিতের বন্ধু॥		
হীন আলাওলে কহে তাহান আদেশ।		
আয়ু যশ ভাগ্য পূর্ণ বারৌক বিশেষ॥		
##  বাহরাম যুদ্ধ জিনিয়া এরাকের রাজা হইবার বিবরণ		
*(দীর্ঘ ছন্দ — রাগ কেদার)*		
নৃপ বাহরাম গোর, সিংহ জিত সের জোর, পিতৃ পাটে হরিয়ে বসিয়া।		
দিয়া নানা সুপ্রসাদ, লোকের পুরিল সাধ, দান কৈল ভাঙার ভাঙিয়া॥		
পাই বাহরাম দান, সব রাজ্য সসম্মান, ভিক্ষুক সকল হৈল ধনী।		
সেবে কৈল আশীর্বাদ, পুরোক মনের সাধ, যুগে২ জিও নৃপমণি॥		
খণাইয়া ছলবল, নাশি কর্ম অমঙ্গল, কৈল সুনিয়ম ধর্ম নীত।		
নরে বলিবে বলন্তু, কুটু কুটু না বলন্তু, ছাগ মেষ নাই ব্যাঘ্র ভীত॥		
কুগ্রহ ছাড়িল দেশ, শুভগ্রহ প্রবেশিল, সৈন্য পূর্ণ হৈল বসুমতি।		
উদ্যানের রক্ষগণ, ফলে নম্র অনুক্ষণ, সুখানন্দি হৈল নিরবতি॥		
দুষ্ট দস্যু খল মারি, তস্কর অঙ্গুরে করি, নরের দুর্গতি কৈল দূর।		
হাটে বাটে পেলে ধন, বাহেরয় কোন জন, বিধবা না হিংসে শত সুর॥		
সত্য ধর্মে পালে রাজা, শাস্ত্র নীতি করে কার্য, ঈশ্বর আরতি ধরে মনে।		
যে করিল শত্রু ভাব, না দেখিয়া নিজ লাভ, সেবে আসি ভজিল চরণে॥		
আদ্য নৃপ বল ত্রাসে, যত গেল ভিন্ন দেশে, ধর্ম শ্রী আরি আইল পুনর্বার।		
বাহরাম বীর দর্পে, নৃপ সব ত্রাসে কেঁপে, সকলে পাঠায় রায়বার॥		
যথা করে কোপ দৃষ্টি, নাশয় তাহার শৃষ্টি, হিন্দু চীন রুম নৃপ সব।		
ভাঙিয়া সকল বল, কৈলা এক ছত্র তল, দশ গুণে বাড়িল বৈভব॥		
এমেতে বৎসর তিন, দেশ হৈল দোষ হীন, সর্ব লোক আনন্দে বন্ধয়।		
প্রভু গত নিজ চিত, পুণ্য ধর্ম কর্ম নীত, অবিরত ঈশ্বর সেবয়॥		
লোক হিত গুণি মিত, বিনু ধিরা গদ চিত, শ্রীযুক্ত ছৈয়দ মহাম্মদ।		
তাহান আরতি গুণে, হীন আলাওলে ভনে, আয়ু বংশ রিদ্ধি স্বসম্পদ॥		
*(জমক ছন্দ — রাগ কামদ)*		
নৃপ বাহরাম গোর আসিয়া আজম।		
সর্ব দেশ বশ করি দেখাই বিক্রম॥		
প্রত্যর্থে পাত্র এক আজমে রাখিয়া।		
আপিন আইল তবে ইমেন চলিয়া॥		
দুঃখি লোক সুখী হৈল সুখী ধিকে ধিক।		
মতিভার হই প্রভু নিচেন্তে খানিক॥		
নানা সুখ আনন্দে ভুলিয়া সর্বজন।		
টুকেক না করে কেহ ঈশ্বর স্মরণ॥		
তবে ক্রোধযুক্ত হৈয়া প্রভু নিরাকার।		
নিষেধিল মেঘ প্রতি তথা বরিবার॥		
ফল হীন তরু যেন ক্ষেত শস্য হীন।		
শুখাইল ঝর্ণা নদী পড়িল দুঃখ দিন॥		
না রহিল রুক্ষ পত্র মহী শেষ কাটি।		
কাঞ্চন রতন তুল্য হৈল এক রুটি॥		
তৃণ জল বিনে মরে চতুষ্পদগণ।		
মৃত্যুকে মনুষ্য সেবে করয় ভক্ষণ॥		
এ শব্দ রতান্ত বাহরাম নৃপে শুনি।		
চিন্তাকুল হই নিদ্রা না আলে রজনী॥		
আজ্ঞা কৈল্য যথা আছে সেশেয়ার ভাঙার।		
ধার মেলি দেও অর্ধ মূল্যে কিনিবার॥		
অর্ধ মূল্যে কিনিজ যেতেক ছিল ধনি।		
নির্দীনীরে দান দিল পরিজন গুণি॥		
এই মেত নিয়মে লিখিয়া বাহরাম।		
প্রতি দেশে বার্তা পাঠাইল তুরমান॥		
স্থানে২ অন্নশালা দিতে জলছত্র।		
পুনঃ পুনঃ দেশে২ লেখিলেক পত্র॥		
পক্ষীগণ ভক্ষ হেতু ছিটিল প্রান্তর॥		
নিয়ম করিয়া দিল প্রতি ঘরে ঘর।		
বহুবিধ অন্নশালা দিল নিজ দেশে॥		
পরিপূর্ণ ভুঙ্গায় যেথক লোক আইসে।		
জুম্মা দিনে নৃপতি হইয়া রোজাদার॥		
সমস্ত রজনী সেবিলেক করতার।		
শেষ রাত্রি সজিদা করিয়া মাগে বর॥		
আয় ভক্ষদাতা প্রভু ত্রিজগ ঈশ্বর।		
অনেক অপার জীব তুমি তার রক্ষ॥		
এক নপাসরি সবানেরে দিছ ভক্ষ।		
যেই কীট রাখিয়াছ অন্তরে পাষাণে॥		
তাহার আহার নিয়োজিছে সেই স্থানে।		
রজ্জাক আপনা নাম রাখিছ আপনে॥		
ভক্ষদাতা আর নাই তুমি এক বিনে।		
যদি পাপ পূর্ণ অধ আমি দুরাচার॥		
তোমার কৃপাল নাম ভরশা আমার।		
ব্যাঘ্রযুগ মেধ্যে হেন্তে হরি শির তাজ॥		
পাইলুং আজম দেশ আদি নানা রাজ।		
যুঝিণু ক্ষুদ্র হেন্তে এই নেহ মহা কাম॥		
কার্য সিদ্ধি যুক্তি হেতু শ্মরি তোমা নাম।		
সর্ব মেতে আমার পাশের নাহি ওর॥		
যুই মাত্র সাস্তি যোগ্য পাপ হেতু মোর।		
প্রতি স্ব-সময় কর কৃপাময়॥		
দেখিতে প্রজার দুঃখ দহয় হৃদয়।		
মুই বার্তা না পাইতে মরিল যত লোক॥		
অন্তরে বিদরে মোর ভাবি সেই শোক।		
পাপী পাপ ক্ষেমিয়া পরম দয়াময়॥		
কৃপা করি শান্ত কর তৃষিত হৃদয়।		
সমস্ত রজনী চেয়ে না আছিল নিদ্রা॥		
কাকর্বাদ করিতে লাগিল তেজিত্রা।		
অকস্মাৎ তখনে শুনিল দৈব বাণী॥		
আর না করিও চিন্তা শুন নৃপমণি।		
সুখরসে ভুলিয়াছে তোর দেশ লোক॥		
