আলাওল		
ক্ষেণে তপ জপ সাধে ক্ষেণে ধ্যানে বৈসে		
ক্ষেণে রুক্ষ পত্র ভক্ষ্যে ক্ষেণে উপবাসে॥		
এই মতে ছয় মাস করিতে কষ্টতা		
আসিয়া সাক্ষাৎ হৈল অরণ্য দেবতা।		
বলিল নৃপতি তুমি কেনে কষ্ট পাও		
রাজ্যপদ দিছে বিধি আর কিবা চাও॥		
আরব আজম তুমি কত রাজ ভূমি		
অতি ভাগ্য হেতু একা পাইয়াছ তুমি।		
শীঘ্র দেশে গিয়া কর লোক উপকার		
ন্যায় বিনু নৃপতির তপ নাই আর॥		
ধর্মে রাজ্য পালিলে সকল বাঞ্ছা সিদ্ধি		
ধর্ম ভাব হইলে প্রসন্ন হয় বিধি।		
নৃপে বলে দেব মোর মনে নাই বাঞ্ছা		
পুত্র মোর অরুণি চিরায়ু হৈতে ইচ্ছা॥		
দেবে বলে বিধাতা সৃজিল শুভক্ষণে		
বিশেষ তোমার তপে তুষ্ট হৈল মনে।		
রাজ্যপদ তেজিয়া ইচ্ছিলা বনবাস		
বিধাতা পামর নেহ পুরাইব আশ॥		
পাটে গিয়া লোক পাল ন্যায় ধর্ম চিতে		
তোমার আবেশ পূর্ণ হৈব সর্ব মতে।		
এত শুনি নৃপতি হইল হরিষত		
বন হেন্তে নিকলিয়া চলিলা তুরিত॥		
বাপের অবধি গুণি নৃপ বাহরাম		
নিশি দিশি হেরি পন্থ রেহে অবিশ্রাম।		
নিশাকালে আইল নৃপ গড়ের নিকট		
বাহরাম দৃষ্টি মাঝে হইল প্রকট॥		
অবধি স্থিরিয়া বাহরাম মহাশয়		
বিশেষ জ্যোতিতেষ গণি করিছে নির্ণয়।		
গড়ের প্রাচীরের উঠি রহিছে আপনে		
পিতৃ হেরি দ্বার মেলি দিল তৎক্ষণে॥		
না হইতে পুরি মেধ্য প্রবেশ রাজন		
বাহরামে গিয়া হৈল চরণ বন্দন।		
আলিঙ্গন দিয়া নৃপ গ্রানিল কপালে		
টঙ্গিতে উঠিল দোহ মন কুতূহলে॥		
যে কিছু কহিতে যোগ্য পুত্রেবে কহিয়া		
শয়ন করিল নৃপ ভোজন করিয়া।		
প্রভাতে উঠিয়া নৃপ বসি নিজ পাটে		
সকল অমাত্যগণ ডাকিয়া নিকটে॥		
আরেবের সীমা লেখি পুত্র সমপিয়া		
আপনে নৃপতি গেল এরাকে চলিয়া।		
শ্রীমন্ত মোহন্তা ছৈদ মহামদ খান		
বাক্য রস গুণ জ্ঞাতা শত অবধান॥		
দানে মানে গুণ জ্ঞানে ধর মুচরিত		
উপকর্তা দুঃখ হর্তা গুণি হিত মিত।		
তাহান আরতি হীন আলাওলে গাহে		
সেই ধন্য মহা পুণ্য কীর্তি ভরি রহে॥		
## বাহরাম রাজার মুসলমান হইবার বিবরণ		
*(দীর্ঘ ছন্দ — রাগ কেদার)*		
বাহরাম নৃপমণি সর্ব শাস্ত্র মর্ম জানি		
ভাবিয়া মেনেতে হৈল সার।		
পড়িয়া সকল গ্রন্থ ভাবিয়া বুঝিল অন্ত		
মুসলমান সম নাই আর॥		
শ্রেষ্ঠ দিন মহামদ এতোধিক নাহি পদ		
মনান্তুরে কহিল নিশ্চয়।		
বাপ মাও পরিত্রাণ হেতু মাত্র ফোরকান		
আর মাত্র উদ্ধার না হয়॥		
নচাহিয়া বাপ মুখ ইচ্ছিয়া উম্মত সুখ		
এমন কৃপাল আর কোথা।		
যাঁর ভাবে নিরাঞ্জন সৃজিলেক ত্রিভুবন		
তাঁর ভাবে মুক্তি এ সর্বথা॥		
এই দড়াইয়া মনে ডাকি গুরু নেয়মানে		
পুনিং বিচারি বুঝিলা।		
সব দিন হৈল ফানি		
সর্ব সার মুসলমানি তেতে জানি ইমান আনিলা॥		
মুসলমান হৈল জবে ধিক যুতি মন্ত তবে		
হইল নৃপতি বাহরাম।		
যেতক পূর্বের নীতি সব করি বিপরিতি		
দাড়াইল দিন ইছলাম॥		
সতত মৃগয়া করে গণ্ড মহিষ মারে		
নিলগোম সের নাহি ওর।		
বহুদিন গোর-খর আখেটয় নিরন্তর		
নাম হৈল বাহরাম-গোর॥		
আখেটের মাংস বিনে ভোজন নাহিক আনে		
সর্ব লোকে দেখিয়া বিস্ময়।		
হেরিয়া অব্যর্থ বান সব হৈয়া ছটকমান		
পানি যুগে আসিয়া চুষয়॥		
ঘোটক আক্ষর নাম পবন জিনিয়া গাম		
গিরি বনে বিজলিত ধায়।		
তেজিয়া ভৈশ্রবগণ তাহে মাত্র আরোহণ		
দৃষ্টি মাত্র পশু না এড়ায়॥		
আছিল নইম নাম ধাত্রী পুত্র অনুপাম		
এক পাঠে পড়িলা সদত।		
এক স্থানে নিশি দিন আছিল বিচ্ছেদ হীন		
সর্ব কার্য তার হস্তগত॥		
যেই স্থানে যেই পুঞ্জি সপ্তম গৃহের কুঞ্জি		
তাহাতে সপিছে নরপতি।		
সঙ্গে হেন্তে নেহ দূর যেন যুতি নএ সুর		
মর্ম শীল সপ্রতায় অতি॥		
বন বিহারিতে রঙে সে নইম থাকে সঙ্গে		
যেই ক্ষণে তুরঙ্গ ধাবায়।		
আক্ষরের পদেরহু না হেরে নইম বিনু		
সেই লক্ষ্যে পাছেই ধায়॥		
দানে ধর্মে অনুরক্তা অতিথি গুরুর ভক্তা		
শ্রীযুত ছৈয়দ মহামদ।		
তাহান আদেশ মনে হীন আলাওলে ভনে		
আয়ু যশ বারুক সম্পদ॥		
*(জমক ছন্দ — রাগ পাঠ মঞ্জুরী)*		
অতি বীর স্বরধির বাহরাম গোর		
সকল নৃপতি শুনি ত্রাস নাহি ওর।		
মিহির মৃগয়া খেলা বিনে নাহি কাম		
তিলেক না লয় মুখে রাজপাট নাম॥		
সুরা খেঁট বিনে মাত্র নাহিক আরতি		
পাত্রগণে রাজ্য করে নইম সঙ্গতি।		
পাঠে না থাকয় মাত্র খেলা সুরা পান		
সতত মৃগয়া বিনা কার্য নাহি আন॥		
ব্যাঘ্র সঙ্গে খেলা খেলি মারয় পশ্চাতে		
এক শর বিনা দুই না ধরয় হাতে।		
অশ্ব তেজি ব্যাঘ্র সঙ্গে পদব্রজে খেলা		
যেন অস্ত্র হেন্তে খেলে পাইকের মেলা॥		
ব্যাঘ্র অগ্র হেন্তে ধুর্মে অস্ত্র বিনা ধায়		
ক্রোধ বেগে ধায় দ্বীপ লাগ নাহি পায়।		
লাগ না পাইয়া ব্যাঘ্র ধাইতে ফিরিয়া		
মারয় ঘোটকী লাথি বেগে আসি ধাইয়া॥		
এক ঘায়ে কটি ভাঙি শীঘ্র দেয় প্রাণ		
দেশেই প্রসরিল এসব বাখান।		
চারি বৎসরের গোর যাবত না হয়		
কদাচিত বাহরামে তারে না মারয়॥		
যত গোরখর আদি কিবা নিল গাও		
পশু বন্দি হেতু অঙ্গে না মারয় ঘাও।		
অশ্ব পৃষ্ঠে থাকিয়া বাণুড়া লই হাতে		
গেলে বাজাইয়া ধরে ফঁদে নরনাথে॥		
দক্ষিণ নাইরেঙে দাঘ দিয়া মুক্ত করে		
অন্যত্র আখেটী তারে না মারয় ডরে।		
কেহ নমারয় তারে পাইয়া নিকট		
বাহরাম দাগে পশু এড়ায় সংকট॥		
## সিংহ এবং গেজর যুদ্ধের বিবরণ		
*(চন্দ্রাবলী ছন্দ — সুহি রাগ)*		
রঙে একদিন বেহারির বিপান		
সঙ্গে লই সেনাগণ।		
নইম সঙ্গতি বেহারে নৃপতি		
প্রবেশি আখেটী সণ॥		
তেজিয়া কানন প্রান্তরের গমন		
রেণু উড়ে আগে আগে।		
কেহ না হেরয় মাত্র ধুলিময়		
বিলোপে পবন বেগে॥		
তক্ষ ধাবাইয়া নিকটে আসিয়া		
দেখি পড়ি গেল ধন্দে।		
মহা সিংহ এক বল অতিরেক		
ধরিল হস্তির স্কন্ধে॥		
মহা বলবন্ত সেই গজদন্ত		
সদা হানে স্থব ঘাও।		
ঘন স্কন্ধ ঝারে ধায় মহা লরে		
করি বিপরীত রাও॥		
মস্তক ফাড়িতে নপারে তুরিতে গজ বলবন্ত অতি		
দেস্তের কামেড়ে নৌখের আচেড়ে		
বিদারয় যুগ পতি।		
আইল নিকট দেখিয়া প্রকট		
নৃপতি এড়িল বান॥		
সিংহ হেন্তে হানী ভেদিল মেদিনী		
নৃপতি বলবান।		
বিরেন্দ্র মণ্ডল বলে অখণ্ডল		
বজ্র সম এই স্বর॥		
হস্তী স্বর ছিটি জিনি পরিপাটি		
কেবা আছে সমস্বর।		
বাহরাম গোর তুরঙ্গ আক্ষর		
ফিরিলা আপন স্থান॥		
যেন খরতরে গেল চিত্র ঘরে		
টঙ্গি হৈল আরোহণ।		
গুণী জন বন্ধু দানে দয়াসিন্ধু		
ছৈদ মহামদ খান॥		
তাহান আরতি মধুর ভারতি		
হীন আলাওলে ভনে।		
*(জমক ছন্দ)*		
সিংহ গজ হানি ভূমে লুকাইল স্বর		
এই শব্দ প্রসরিল দেশ দেশান্তর।		
শুনিয়া নৃপতি কুল মনে পাইল ভীত		
শত্রু মন ত্রাস মিত্র মন আনন্দিত॥		
আরেবর লোক সেবে ভাবি কল্য সার		
দুই রাজ্য পাল যোগ্য হইল কুমার।		
সে রাজার বাহরাম গোর হৈল নাম		
কোন নৃপ গৃহে নাহি হেন গুণধাম॥		
আর দিন আখেটে চলিল মহারাজ		
সঙ্গতি করিয়া যত বীরেন্দ্র সমাজ।		
এক মাদি গোর সেই পরম রূপসী		
প্রান্তরের মধ্যভাগে দাড়াইল আসি॥		
স্বকাজল আঁখি যুগ শ্রীখণ্ড কপাল		
শৃঙ্গ যুগ মেধ্যে ক্ষত যেন চন্দ্র বাল।		
শ্যামল সুন্দর মাঝে মাঝে শ্বেত রেখা		
বল ঘন সমুহে চন্দ্রিমা দিল দেখা॥		
মুক্ত পুচ্ছে ভেদি পৃষ্ঠে ধবল সু-রেখ		
সুধির বিজুলি যেন দেখি পরতেক।		
সুচারু চরণ চারু কমল উদর		
দুগ্ধপূর্ণ স্তন গুরি পরম সুন্দর॥		
সৈন্য পাছে রাখি বাহরাম অগ্রগণ্য		
দেখিয়া গুরিণী রূপ বলে ধন্য ধন্য।		
গোর মুখ পূর্ণ জ্যোতি সকল প্রান্তর।		
হেন রূপ গোর মাদি নাহি দেখি আর		
পূর্ণ ঠাট দেখিয়া নধায় কি কারণ।		
বুঝিতে না পারি এই পশুর লক্ষণ		
সৈন্য ছাড়ি নিকটে আসিতে বাহরাম।		
ভূমে শির দিয়া গুরী করিল প্রণাম		
দুই হস্ত তুলিয়া করিয়া উচ্চ রাও।		
চলিলেক অন্য মুখী যেন উগ্র বাও		
বুঝিয়া চরিত্র বাহরাম নরপতি।		
পাছেই অশ্ব ধাইয়া যায় শীঘ্রগতি		
বহু বনবেওর কণ্টক বহি যায়।		
ধীর গতি তৃণ বিশ্রামিয়া ধিরে ধায়		
ধাইতেই যদি অরুণ হানিল।		
উতঙ্গ পর্বত এক সম্মুখে দেখিল		
সেই পর্বতের হেটে মহা এক গর্তে।		
তৃণাঙ্কুর বনস্পতি নাহিক তাহাতে		
শতাকেত মনিষ্য তথাতে নাহি যায়।		
গর্ত পাশে সর্প এক অতি মহা কায়		
অল্প দূরে থাকি গুরী করিয়া বিশ্রাম।		
শব্দ করি ইঙ্গিতে জানাইল বাহরাম		
রক্ষতলে রহিলেক হইয়া অন্তর।		
নৃপ বলে সত্য হেন দেখি অজাগর		
এই সর্পে তার বাচ্ছা খাইছে নিশ্চেত।		
দাদ লৈতে গুরী গেল আমার বিদিতে		
এই অজাগর যদি নমারি পরানে।		
অল্প বির্য হেন জ্ঞান হৈব পশু মনে		
দারুণ প্রগাড় সর্প অতি মহাকায়।		
যেন মহা বৃক্ষ উখাড়িছে উগ্রবায়		
এত বড় জন্তু না হইছে দর্শন।		
কি বুদ্ধে মারিব তারে ভাবে মনে মন		
দাদ লৈতে যদি পশু গেল মোর পাশ।		
পুরুষতা নেহ মনে করিলে তরাশ		
ঈশ্বর কৃপায় ধন্য আমার জীবন।		
ন্যায়বন্ত বীর ভাব হৈব পশু মন		
তার সঙ্গে যুদ্ধ করি কিবা জন্য মেরা।		
আর কি লাগিয়া হেন্তে ধনুর্বান ধেরা		
শিলাভেদ বানে মোর কার আছে রক্ষা।		
এহার উপরে মোর অস্ত্রের পরীক্ষা		
অশ্ব অথবার শান্ত হৈছে অতিরেক।		
তরুতলে বিশ্রাম করিল তিল এক		
জলের নৌবক খুলি অতি তুরমান।		
অশ্ব মুখ ধোরাইয়া হৈল্য জল পান		
বেগে ধাই অশ্ব পুনঃ নিকটে আসিয়া।		
মহা শব্দ করিলেক সর্পেকে হেরিয়া		
হাক শুনি অজাগর হৈয়া ক্রোধ মন।		
গ্রাশিতে আসয় তারে প্রসারি নয়ন		
গর্জিয়া উঠিল যেন হৈল বজ্র পাত।		
স্বাস সঙ্গে স্ফুলিঙ্গু নিম্বরে সহসাত		
পশু পক্ষী ত্রাস পাই ধাইল তুরিত।		
না কম্পিল বাহরাম শরীর নিভিত		
অশ্ব ধাবাইল যাই সর্পের দক্ষিণে।		
এক শরে চক্ষু যুগ ভেদিল সন্ধানে		
পুচ্ছ ফিরাইতে শীঘ্রে হইল অন্তর।		
চক্রে মত ভ্রমিতে লাগিল অজাগর		
পুচ্ছাঘাতে বৃক্ষ সব পড়ে দড় মড়ী।		
অতি সান্ত হৈয়া শেষে ভূমে পড়ে গাড়ি		
তবে বাহরাম তার নিকটে আসিয়া।		
অর্দ্ধ চন্দ্র বানে শির ফেলিল কাটিয়া		
অশ্ব হেন্তে লামি তীক্ষু খর্গ লৈয়া হাতে।		
গ্রীবা পুচ্ছ পর্যন্ত ছিঙ্গিল এক ভিতে		
পেট হেন্তে গো-বৎস ফেলে নিকালিয়া।		
অথ্থে আরোহিল শীঘ্রে হেন্তে খর্গ লৈয়া		
নৃপিতর অশ্মবার দেখিয়া গুরিণী।		
গর্ত মেধ্যে প্রবেশিল সন্তাই নমানি		
তার পাছে জবে প্রবেশিল বাহরাম।		
দেখিল বহল পূর্ণ রত্ন সেই ঠাম		
ভূমি শীর দিয়া গুরী গেল বনান্তরে।		
ধীরেই বাহির হইল নৃপবরে		
মহা জন্তু মারিয়া পশুর দিল দাদ।		
বহ রত্ন ধন পাইল ঈশ্বর প্রসাদ		
সোকরানা নমাজ পড়িল বাহরাম।		
অথারোহে রক্ষতলে করিল বিশ্রাম		
রুটি পাকাইল যেই সঙ্গেতে আছিল।		
অথের ভুঙ্গাইল কিছু আপনি খাইল		
হেন কালে নইম আইল সেই স্থান।		
তার পাছে সৈন্য সব আইল বিদ্যমান		
অজাগর বধ দেখি সব ধন্দ হৈয়া।		
নৃপতির বাহু যুগ পুজিল আসিয়া॥		
কার শক্তি একাষর এ জন্তু মারিব।		
সহস্রেক যার ভয়ে কাছে না আসিব॥		
তবে আজ্ঞা বৈকলা নৃপ গর্তে প্রবেশিতে।		
যত ধন রত্ন সব নিগতি করিতে॥		
সকলে মিলিয়া দ্রব্য বাহির করিল।		
তিন শত উট রত্ন কাষ্টে ভরিল॥		
নানা বাদ্য ধ্বনি করি আনন্দ বিশেষ।		
দুই দিন হাটি আসি লংঘিলেক দেশ॥		
তবে নৃপ যেমতে মারিল অজাগর।		
লেখিয়া রাখিল নিয়া টঙ্গির উপর॥		
রাজ মোক্ষ সৈন্য মন্ত্রী শরনীর হিত।		
শ্রীযুত ছৈহদ মহাম্মদ সুচরিত॥		
জ্ঞান বাক্যরস যিনি সুরাসুর গুরু।		
তাতে সেতে মহি পূর্ণ মহিমা সুচারু॥		
অবনী পূরিত যশ স্মৃতি বাখান।		
মালতী চন্দন চন্দ্র শরদ সমান॥		
তাহান আদেশে হীন আলাওলে গায়।		
প্রভু ভক্তি বাঞ্ছা সিদ্ধি রহুক সদায়॥		
##  শিকারের ধন বিভাগ করিয়া দিবার বিবরণ		
*(জমক ছন্দ)*		
পাটেত বসিয়া বাহরাম সুচরিত।		
ষাটিল বহল ধন হই হরিষত॥		
দশ উট পূর্ণ স্বর্ণ রত্নে ভরিয়া।		
এরাকে পাতার আগে দিল পাঠাইয়া॥		
আর দশ উট দিল অমাত্য সবার।		
দশ উট বিবর্তিল সৈন্য সামন্তর॥		
যেতক সেবক করে নিকটের কাম।		
পুনঃ পঞ্চ উট বিবর্তিল ব্রাহ্মণধাম॥		
নইন করিয়া আদি ইষ্ট মিত্র গণ।		
যার যেই যোগ্য মতে বৈকলা বিতরণ॥		
নিজ ভুজার্জ্জিত ধন প্রথমে পাইয়া।		
অনুরূপে সকলেরে দিল বিবর্তিয়া॥		
মহাস্বর ধর্যবন্ত দাতা সু-পণ্ডিত।		
অবিরত নৃত্য গীত রসে মগ্ন চিত॥		
একদিন বাহরাম যাইতে আহারে।		
ভ্রমিতে লাগিল প্রতি গৃহের অন্তরে॥		
সপ্তম গৃহেতে অতি হরিষত চিতে।		
ইচ্ছা হৈল গৃহের অন্তরে প্রবেশিতে॥		
মনে ভাবে আমি এই গৃহের ঈশ্বর।		
নজানি কি আছে এই টঙ্গির উপর॥		
যেই গৃহি আপনা গৃহের বস্তু চিনে।		
কোন দ্রব্য গোপ্ত নহে তাহার নয়নে॥		
এ লাগি উচিত নিজ গৃহ বিচারিতে।		
রত্ন সব চিনিলে তষ্করের নারে নিতে॥		
নইম আদেশ পাই মেলিল দুয়ার।		
প্রবেশিল নরপতি গৃহের মাঝার॥		
দেখিলেক গৃহে সব রজতের কুঞ্জি।		
হেরাইতে নয়ন ধরয় মুতি পুঞ্জি॥		
আর সব যেরে নাহি লেখে এ সকল।		
তথাতে গাঁথিছে সব পবিত্র নির্মল॥		
যেই দেগে হেরে বন্দি হয় দৃঢ় মন।		
বিশেষ রাখিছে ভরি বহু রত্ন ধন॥		
এক ভিতে লিখিয়াছে পরম সুন্দর।		
মোহন মুরতি স্বত্র সপ্ত পয়কর॥		
সপ্ত রাজ্য ঈশ্বরের দিয়া সপ্ত কন্যা।		
লিখিয়াছে ভিন্য ভিন্য অতি রূপ ধন্যা॥		
হিন্দু নৃপ দুহিতা হরকা তার নাম।		
পূর্ণচন্দ্র সম রূপ অতি অনুপাম॥		
খাকান নৃপতি সুতা নাম এখলাজ।		
